ID,Dialogue_id,Utterance_id,Speaker,Sentence,Label
9465,256,4,傅明,20块钱一股,1
9466,256,5,傅明,我入了10股，你入多少？,0
9467,256,6,傅明,可不能买的多呀那现在还是很抢手的嘞,0
9468,256,7,傅明,我们这是内部调剂总还要给群众，多留一些嘛,1
9469,256,8,小凡,那也行我呢，也就甭太特殊了,0
9470,256,9,小凡,我来1股,1
9471,256,10,小凡,20块钱，您数好,0
9472,256,11,傅明,好的，好的，我给你打一个条子,0
9473,257,0,和平,谁呀 谁呀,0
9474,257,1,和平,哟哎哟 来了我介绍介绍这是苏苏他爸,0
9475,257,2,志国,我们认识,0
9476,257,3,和平,这是苏苏,0
9477,257,4,圆圆,我们认识,0
9478,257,5,和平,都 都认识是吧赶紧来 来这边儿坐,0
9479,257,6,志国,坐吧 坐吧,0
9480,257,7,和平,来来 这这我刚要去我女儿啊突然她不舒服了我就说我改天再去,0
9481,257,8,苏苏爸,不必了今后啊也不再麻烦你了我们是告别来了,0
9482,257,9,和平,上哪儿啊,0
9483,257,10,苏苏爸,孩子的奶奶和爷爷在上海一直想接他过去念书我的公司呢最近在上海设了一个办事处我要去料理一下所以呢带他去上海住一段时间,0
9484,257,11,志国,那什么时候回来呀,0
9485,257,12,苏苏爸,那就不一定了孩子也许不来了,0
9486,257,13,苏苏,这个城市 让我伤心,0
9487,257,14,和平,你你 你们什么时候走啊,0
9488,257,15,苏苏爸,今天晚上八点五十的飞机呀孩子在家一直等着您估计你可能是又有事去不了了所以呢让我一起和他一块儿来向您 啊不向你们全家告个别,0
9489,257,16,志国,老苏同志你怎么说走就走啊,1
9490,257,17,和平,真是,0
9491,257,18,苏苏爸,孩子你不是有一句很重要的话要对阿姨说么说吧 时间来不及了,0
9492,257,19,苏苏,阿姨我一直想管您叫一声妈妈,0
9493,258,0,志国,完了，完了，完了要这么连着下雨，多好的柑橘也得烂光喽,0
9494,258,1,和平,我那两千,1
9495,258,2,傅明,我那二百呀,1
9496,258,3,小凡,我那二十,1
9497,258,4,保姆小张,我的两块,1
9498,258,5,圆圆,我的两毛,1
9499,258,6,圆圆,二叔，你的二分也吹了,1
9500,258,7,志新,我找燕红算账去，这好好的一家子算是毁她手里了,1
9501,259,0,电视台女记者,准备好了么？开始可以了,0
9502,259,1,电视台女记者,观众朋友们，你们好京华纵横栏目又和大家见面了,0
9503,259,2,电视台女记者,今天呢，我们要向大家介绍一位非常有意思的人物,0
9504,259,3,电视台女记者,阳光雨露育青松，改革时代出英雄现在呢向大家介绍的是今天下午见义勇为不顾自己的生命安危而抢救落水儿童的贾志新同志,0
9505,259,4,电视台女记者,啊贾志新同志，你好,0
9506,259,5,志新,你好,0
9507,259,6,电视台女记者,你好,0
9508,259,7,志新,你好！您真是太好了,1
9509,259,8,志新,您都有男朋友了吧,0
9510,259,9,电视台女记者,有了,0
9511,259,10,志新,您怎么也不跟我商量一下儿呀,1
9512,259,11,电视台女记者,这事儿吧，唉，停！,0
9513,259,12,电视台女记者,咱们不能谈这个问题咱们得围绕题纲来谈,0
9514,259,13,电视台女记者,好吗，可以么？可以开始么,0
9515,259,14,志新,马小姐，您什么时候开始主持这栏目的？,0
9516,259,15,电视台女记者,时间不长,0
9517,259,16,志新,万事儿开头儿难嘛,1
9518,259,17,电视台女记者,对,0
9519,259,18,志新,这个，有个适应过程，现在适应了吧？,0
9520,259,19,电视台女记者,嗯，还好吧,0
9521,259,20,志新,那您能谈谈主持这个栏目的体会么？,0
9522,259,21,电视台女记者,我主持这个栏目的体会主要有，,0
9523,259,22,电视台女记者,停！对不起，咱们俩谁采访谁呀？,1
9524,259,23,志新,有点儿乱,0
9525,259,24,电视台女记者,行，咱们从头再来，不用着急好，来,0
9526,259,25,电视台女记者,贾志新同志，可以了吧,0
9527,259,26,电视台女记者,贾志新同志，您能谈谈今天下午您是怎么发现落水儿童的么？,0
9528,259,27,志新,这还用发现？我们俩是一块，,1
9529,259,28,志新,对，是我一人儿发现的,1
9530,259,29,志新,我下午啊，我是到公园钓，,0
9531,259,30,志新,那地方好像不许钓鱼哈？,1
9532,259,31,电视台女记者,那地方是禁止钓鱼禁止游泳我们去的时候还有一帮红领巾在做宣传呢,0
9533,259,32,志新,对对对，那我就不是去钓鱼,0
9534,259,33,志新,我到公园我，我背英语，A、B、C、D，我正背的高兴,1
9535,259,34,志新,忽然间听见有人喊,0
9536,259,35,志新,河里面小孩大大的有,1
9537,259,36,志新,我管他哪儿的人呢喊声就是命令冲到河边儿，往下一看,0
9538,259,37,志新,哎呀呀！情况是万分紧急,1
9539,259,38,志新,小孩是生命垂危，怎么办？怎么办？,0
9540,259,39,志新,向组织请示？来不及了！跟领导汇报？等不了了！,0
9541,259,40,志新,我教孩子游泳？不赶趟！,1
9542,259,41,志新,我自己下去，我就上不来了,1
9543,259,42,电视台女记者,您不会游泳啊？,0
9544,259,43,志新,狗刨我会两下儿，我坚持不了多一会儿啊,0
9545,259,44,志新,怎么办？怎么办？袖手旁观？孩子就完了,1
9546,259,45,志新,我下水救人，自己就悬了,1
9547,259,46,志新,就在这万分危急的时刻我脑海中刷刷刷刷刷刷闪出了很多英雄人物,0
9548,259,47,电视台女记者,您都想起谁来了？,0
9549,259,48,志新,我想起了董存瑞炸碉堡，就像冬天里的一把火；,1
9550,259,49,志新,邱少云焚烈火，熊熊火光照亮了我；,1
9551,259,50,志新,黄继光堵枪眼，我用青春赌明天,1
9552,259,51,志新,欧阳海蓝精马你用真情换此生,1
9553,259,52,电视台女记者,对不起对不起，停一下我怎么觉着这哪儿都不挨哪儿啊？,0
9554,259,53,志新,那我再想点儿挨着的？,0
9555,259,54,电视台女记者,行，挨着的，唉，别想了，再想孩子该晕死了,0
9556,259,55,志新,对对对，孩子还跟水里呢,0
9557,259,56,志新,就听见大吼一声助跑，起跳，加速，再起跳，嗖，,0
9558,259,57,志新,一个漂亮地转体三周半加屈体后空翻,1
9559,259,58,电视台女记者,您不会游泳，倒会跳水哈,0
9560,259,59,志新,我跟电视里高敏学的,1
9561,259,60,志新,我下水以后我先是仰泳再是蛙泳再是蝶泳最后我是自由泳,0
9562,259,61,电视台女记者,唉，别动，您怎么又会游泳了？,0
9563,259,62,志新,实践中学习呀，嘟嘟嘟嘟嘟嘟嘟,0
9564,259,63,电视台女记者,汽艇来了？,0
9565,259,64,志新,我游泳就这声儿,1
9566,259,65,志新,迅速我接近这目标一个金蛇缠身，把孩子锁住乘风破浪游向对岸,0
9567,259,66,志新,不光救起了落水儿童捎带脚儿我把全国记录给破了，,1
9568,259,67,志新,累死我了,0
9569,259,68,电视台女记者,贾志新同志，怎么成您一个人救儿童了呢？,0
9570,259,69,志新,后面还有俩他追不上我,0
9571,259,70,电视台摄像,这人是不是有病啊,1
9572,259,71,电视台女记者,啊没事儿，我听说人被水淹过了以后呢会出现暂时地智力低下状况,1
9573,259,72,电视台女记者,贾志新同志，我们能采访一下您的家人么？,0
9574,259,73,志新,哎？我还没开始说呢,0
9575,260,0,孟朝阳,伯父 您看您唱这个怎么样我是一只来自北方的狼,0
9576,260,1,傅明,什么呀 什么呀,0
9577,260,2,傅明,不好 不好不符合事实么什么来自北方的狼我的老家在南方我明明是从南方来的狼不对 来的人么,1
9578,260,3,孟朝阳,这是唱歌又不是唱您,0
9579,260,4,志国,爸 您看这怎么样归来吧 归来哟,0
9580,260,5,傅明,这不好狼刚走了 鬼又来了,1
9581,260,6,志国,什么鬼归来 回来的意思,0
9582,260,7,志新,那我这不都回来了么你们还念叨什么呀,1
9583,260,8,和平,哎 爸爸爸就这个 特别适合您只要你愿意 只要你愿意让我划向你的,0
9584,260,9,傅明,什么我愿意 我不愿意,1
9585,260,10,志新,就是 我也不愿意大礼拜天的不好好歇会儿瞎嚎什么呀,1
9586,260,11,傅明,我嚎怎么了,0
9587,260,12,和平,真是,0
9588,260,13,傅明,我们不光要嚎我们还要把他嚎好今天晚上我们参加比赛的时候啊,0
9589,260,14,傅明,对了 志新啊这次参赛的名单上没有你啊你跟这儿起什么哄,0
9590,260,15,志新,那我不跟这我跟哪儿去呀,0
9591,260,16,傅明,跟哪 跟厨房,0
9592,260,17,和平,对对对,0
9593,260,18,傅明,看我们大家玩的哦不是 忙成这个样子你赶快给我做饭去吧,1
9594,260,19,和平,做饭 做饭,0
9595,260,20,志新,还想着做饭这事呢我当您都忘了么,0
9596,260,21,傅明,别的能忘 这能忘么不光要做 还要做好做不好不成啊,1
9597,260,22,和平,对对就就包饺子吧啊 省事,0
9598,260,23,孟朝阳,对,0
9599,260,24,志新,还省事呢你们这么些人吃我一人包能省事么,0
9600,260,25,孟朝阳,反正我们是省事了二哥 您受点累我爱吃茴香馅的您包点茴香的,0
9601,260,26,圆圆,二叔我不吃茴香我只吃小白菜馅,0
9602,260,27,志国,三鲜馅好吃你包三鲜的,0
9603,260,28,和平,什么三鲜馅鸡蛋韭菜馅的好吃,0
9604,260,29,傅明,行了 不要争了一样包一点都尝尝,0
9605,260,30,志新,那还让不让我活呀,1
9606,260,31,和平,谁不让你活了这不就让你去活,1
9607,260,32,和平,和面么和面 拌馅回头我们帮你一块儿包,1
9608,260,33,孟朝阳,没错儿 没错儿 一块包,0
9609,260,34,志新,和面拌馅拌四种馅,0
9610,260,35,和平,啊,0
9611,260,36,志新,哎要不你们先把我办了得了,1
9612,261,0,傅明,和平同志,1
9613,261,1,志国,和平同志,1
9614,261,2,圆圆,和平同志,1
9615,261,3,和平,我这是挨哪儿呢,0
9616,261,4,志国,你这是在自己的,0
9617,261,5,志国,战友的家里呀,1
9618,261,6,志国,我是志国,0
9619,261,7,志国,我就是你的,0
9620,261,8,志国,我就是你的志国哥呀,1
9621,261,9,和平,志国,0
9622,261,10,和平,-贾志国     -对,0
9623,261,11,和平,啊不对不对,0
9624,261,12,志国,和平 向毛主席保证我是真志国,1
9625,261,13,志国,我绝对不是假志国,1
9626,261,14,志国,我绝对就是贾志国,1
9627,261,15,志国,瞧我姓这姓,1
9628,261,16,和平,你怎么老成这样了你,0
9629,261,17,志国,我 我这还抹了大半瓶儿那什么蜜呢,1
9630,261,18,志国,和平啊 你听我跟你说,0
9631,261,19,志国,和平 是这么回事儿你这不生病了吗,0
9632,261,20,志国,你一生病啊我就着急,0
9633,261,21,志国,我这一着急我就老成这样了,1
9634,261,22,志国,你看我爸他更着急头发都白了,1
9635,261,23,傅明,是啊是啊,0
9636,261,24,傅明,那是急的吗,1
9637,261,25,傅明,对你看啊这个心里边着急着哪,0
9638,261,26,傅明,你要是万一病上有个什么那我们志国可怎么办呢,0
9639,261,27,和平,大爷 大爷 大爷,1
9640,261,28,和平,我叫您呢,1
9641,261,29,傅明,噢 对叫的好 叫的好,0
9642,261,30,傅明,好多年没听她这么叫了 耳生,1
9643,261,31,和平,大爷 那我跟志国的事您都 都知道了吧,1
9644,261,32,傅明,对 知道什么了,1
9645,261,33,和平,我们俩 处朋友,0
9646,261,34,傅明,我不光知道你们俩处了朋友,0
9647,261,35,傅明,我还知道你们俩处朋友以后的事,1
9648,261,36,和平,哎哟 大爷您瞧您人都不好意思了,0
9649,261,37,和平,那我大妈呢她也知道了吧,0
9650,261,38,傅明,你大妈 不认得,1
9651,261,39,志国,她说的是我妈,0
9652,261,40,傅明,噢 你是说志国的母亲啊,0
9653,261,41,傅明,唉 她已经,0
9654,261,42,志国,她已经出差了,1
9655,261,43,志国,哎和平啊你看这是我,0
9656,261,44,志国,这是我妹妹,1
9657,261,45,圆圆,对对对对嗯 阿姨好,0
9658,261,46,和平,哎哟你别管我叫阿姨呀这不乱了吗,0
9659,261,47,和平,哟 看样子反正你怎么也得比我小,0
9660,261,48,和平,你就管我叫姐姐吧,0
9661,261,49,圆圆,姐姐,0
9662,261,50,圆圆,那不更乱了吗,1
9663,261,51,和平,哎呀 不乱不乱,0
9664,261,52,和平,哎 贾志国我怎么瞧你妹妹那么眼熟啊,1
9665,261,53,和平,哎 你挨哪个学校啊,0
9666,261,54,圆圆,我是和,0
9667,261,55,圆圆,我是战斗里小学的,1
9668,261,56,和平,哎哟喂 真的呀,0
9669,261,57,和平,那离我们反修路小学不远耐,1
9670,261,58,和平,哎 你是宣传队儿的吗,0
9671,261,59,和平,上次迎宾迎接西哈努克亲王是不是你也去了呀,1
9672,261,60,和平,哎哟 我瞧你特眼熟喂,1
9673,261,61,志国,坏了这可不止二十年了快成圆圆同学了,1
9674,261,62,志国,和平啊你还记得 你这回是怎么生的病吗,0
9675,261,63,和平,我生病了我不记得呀,0
9676,261,64,志国,你好好想想,0
9677,261,65,和平,嗯我记得我往外跑,0
9678,261,66,和平,在兵团,0
9679,261,67,和平,啊不是,0
9680,261,68,和平,我 我回北京探亲,0
9681,261,69,和平,啊不对,0
9682,261,70,和平,我已经调回来了,0
9683,261,71,和平,啊不对,0
9684,261,72,和平,哎哟 我都乱了,1
9685,261,73,和平,哎 你别说啊,0
9686,261,74,和平,你上大学了吧你,1
9687,261,75,志国,啊哈对对对对对七三年群众推荐 组织批准,0
9688,261,76,和平,真羡慕你人民送你上大学你上大学为人民,0
9689,261,77,和平,上大学管大学用毛泽东思想改造大学多光荣啊,1
9690,261,78,志国,我那是工农兵学员,0
9691,261,79,志国,不对 是光荣是光荣,0
9692,261,80,志国,和平啊 你看你中午就没吃饭你是不是饿了,0
9693,261,81,志国,你想吃什么我现在就给你做去,0
9694,261,82,和平,哎哟 臭不要脸德性我哪能挨你们家吃啊头回来你们家,1
9695,261,83,和平,要不你给我做点儿吧我饿着呢,1
9696,261,84,志国,你想吃什么啊你想吃什么我就能给你做什么,0
9697,261,85,和平,我想吃什么你就能给我做什么,0
9698,261,86,志国,啊 现在市场繁荣物价稳定,0
9699,261,87,和平,那我想吃,0
9700,261,88,和平,炸馒头片儿,1
9701,261,89,和平,再抹上厚厚的一层芝麻酱再撒一层厚厚的绵白糖,1
9702,261,90,和平,咬一口,0
9703,261,91,圆圆,说了半天就吃这个我都能做,1
9704,261,92,傅明,那谁不会做呀,0
9705,261,93,傅明,关键是那会儿没原料,0
9706,261,94,傅明,这个以前啊,0
9707,261,95,傅明,啊对就是现在这些东西都是凭证凭本凭票供应,0
9708,261,96,傅明,每人每月是半斤油半斤糖半两芝麻酱,0
9709,261,97,傅明,还厚厚的一层美死你,1
9710,261,98,和平,哎哟大爷大爷您怎么那么逗啊,0
9711,261,99,和平,我跟贾志国逗着玩呢您还真当真哪就是真做出来我也不会吃的呀,0
9712,261,100,和平,忒腻,1
9713,261,101,和平,哎贾志国要不咱们吃带鱼吧我给你做,0
9714,261,102,志国,你想吃带鱼,0
9715,261,103,和平,嗯 红烧带鱼多好吃啊,0
9716,261,104,和平,我请客得了,0
9717,261,105,和平,这样得了那个咱要买就买好的买最贵的,0
9718,261,106,和平,三毛八一斤的,1
9719,261,107,和平,回头我拿两块钱,0
9720,261,108,志国,嗨 你别掏了别掏了,0
9721,261,109,志国,两块钱留着买鱼虫吧,1
9722,261,110,和平,那行 那你先给我垫上吧,0
9723,261,111,和平,赶紧买去吧赶紧回来,0
9724,261,112,和平,一会儿我回家晚了我妈该催我了,1
9725,261,113,志国,哎 你别回家呀,0
9726,261,114,志国,和平啊你听我说是这么回事儿,0
9727,261,115,志国,你这次生病呢我们没敢告诉你妈怕她老人家着急,0
9728,261,116,志国,想让你呢在我们家多住几天把病养好了呢再回家,0
9729,261,117,和平,那哪儿成啊,0
9730,261,118,和平,咱们俩的关系还没明确呢,1
9731,261,119,志国,还没明确呀 还怎么明确,0
9732,261,120,志国,我的意思是说啊,0
9733,261,121,和平,哎哟我一个大姑娘家家的要住你们家 那多恶心呀,1
9734,261,122,和平,要不然街坊邻居肯定就该该那什么了,1
9735,261,123,志国,那什么呀那谁敢说什么呀 是不是,0
9736,261,124,志国,你又不是别人是我自己的老,0
9737,261,125,志国,老战友,1
9738,261,126,傅明,和平啊我看你还是照着志国的意思先住几天,0
9739,261,127,傅明,也省得你们家里都惦记,0
9740,261,128,傅明,等痊愈了咱们再重返三大革命最前线,1
9741,261,129,和平,大爷说得还真在理儿上,0
9742,261,130,圆圆,妈 阿姨 姐姐,1
9743,261,131,圆圆,这份别扭,1
9744,261,132,圆圆,您真同意住下了,0
9745,261,133,和平,-贾志国    -啊那我睡哪啊,0
9746,261,134,志国,那你不就,0
9747,261,135,志国,那你说呢,1
9748,261,136,和平,如果你没意见的话我就和你,0
9749,261,137,志国,没意见没意见,0
9750,261,138,和平,妹妹一块儿睡吧,1
9751,262,0,志新,圆圆从爷爷那儿偷的这药叫什么灵,0
9752,262,1,圆圆,通便灵朝阳叔叔吃完你那个半生不熟的饺子已经上了四次厕所了再把这药一吃,1
9753,262,2,志新,他就甭出来了,0
9754,262,3,志新,二、四、六、八、十爷爷平时吃几片,0
9755,262,4,圆圆,爷爷平时就吃一片,1
9756,262,5,志新,他年纪大了年轻人火力壮我估计一下吃下去没什么问题吧,1
9757,262,6,圆圆,别介呀你回头再把给他吃死了就给他吃两个 两个,1
9758,263,0,志国,和平你要不愿意看这台我给你换一台,0
9759,263,1,志新,唉嘿嘿唉差不多行了啊,1
9760,263,2,志新,一阵儿了一阵儿的这几天我哥对嫂子又格外热乎了,0
9761,263,3,傅明,估计是学了文件有所提高,1
9762,263,4,和平,您说的对,0
9763,263,5,和平,呆会儿我还得组织他学习呢,0
9764,263,6,志国,啊五号文件又下来了,0
9765,263,7,和平,全是新内容啊,1
9766,263,8,志国,那我还看什么电视咱现在就学去得了,0
9767,263,9,志国,早死早托生,1
9768,263,10,和平,得嘞学去,0
9769,264,0,和平,爸，您这张报纸颠过来倒过去的打我出门您就看，都快两钟头了啊,0
9770,264,1,傅明,就这样啊 中缝我还没有细看呢,1
9771,264,2,和平,嗨中缝都是广告，您看它干什么呀,0
9772,264,3,傅明,广告也很有意思嘛,0
9773,264,4,傅明,你看看这条致富信息啊,0
9774,264,5,傅明,好消息：快速致富培训班即日招生,0
9775,264,6,傅明,科学养殖大尾巴，蛆！,1
9776,264,7,和平,嗨爸，您中午还让不让人吃饭了？,0
9777,264,8,傅明,这还有一条征婚广告,0
9778,264,9,傅明,某女相貌姣好诚征副处级以上男士,1
9779,264,10,傅明,要求对方有汽车，有住房貌美体健、不吃葱蒜未婚离异均可,0
9780,264,11,和平,这条件哪找去她？,0
9781,264,12,傅明,怎么找不着啊？,0
9782,264,13,傅明,我就是嘛，她要求是副处级以上我都副局级了嘛,1
9783,264,14,傅明,不吃葱蒜，我平常就不怎么爱吃,0
9784,264,15,傅明,当然吃饺子的时候，以后可以不吃嘛,1
9785,264,16,傅明,未婚离异均可,0
9786,264,17,傅明,这个，你看看,0
9787,264,18,和平,您说您占哪条吧？您既不是未婚，也不是离异,0
9788,264,19,和平,我婆婆那叫自然死亡，您这叫丧偶,0
9789,264,20,和平,离婚的可以，丧偶的人家不要,1
9790,264,21,傅明,岂有此理嘛，我老伴怎么没的，她管得着吗？,1
9791,264,22,和平,反正您这条件人家不收,0
9792,264,23,傅明,她收啊，我还不给呢！,1
9793,264,24,傅明,你看这还有一条啊,0
9794,264,25,傅明,接受我的关怀，期待你的笑容生活之友心理诊所带着你走上健康之路二十四小时全天服务地址：杨柳北里十八号202室,0
9795,264,26,和平,爸爸，等会等会 这不是咱家的地址吗？,1
9796,264,27,和平,我知道了，那是杨柳北街十八号那是医学院研究所，您瞅啊这一字之差,0
9797,264,28,傅明,看看，一字之差，万里之别呀,0
9798,264,29,傅明,我早就跟你们说过，要过细地做工作过细呀！,0
9799,264,30,傅明,粗枝大叶不成，粗枝大叶往往要搞错,0
9800,264,31,和平,我这儿给人家打电话 让人家赶紧更正别回头看病的跑咱家来了,0
9801,264,32,傅明,啊这个心理诊所是治什么病的？,0
9802,264,33,和平,也不是什么病，就是做做思想工作,0
9803,264,34,傅明,做思想工作是件好事嘛啊你先把电话放下,1
9804,264,35,傅明,报社的同志也很忙我们就不要再给人家添麻烦了,1
9805,264,36,和平,爸，你不给报社添麻烦咱家可就麻烦了,0
9806,264,37,傅明,哎呀，有什么可麻烦的？,0
9807,264,38,傅明,假如真有病人到咱们家里来看病,0
9808,264,39,傅明,这思想工作我拿手啊我可以给他看嘛,1
9809,264,40,傅明,和平哪，我记得咱们家有一件白大褂你找出来，我要穿上,0
9810,264,41,和平,您没事挨家穿白大褂干吗呀？,0
9811,264,42,傅明,你看报上登了咱们家是诊所嘛诊所，得有个大夫嘛,1
9812,265,0,于大妈,哎呀你们又没锁门又没锁门,0
9813,265,1,和平,哎哟，于大妈坐下吃点啊,0
9814,265,2,于大妈,哎呀，你们吃，我来通知个事儿,0
9815,265,3,于大妈,那个咱们区老龄委决定啊下个月举行一次全区十佳健康老人评比活动,0
9816,265,4,于大妈,办事处呢给了咱们居委会一个参加预赛的指标唉老傅你看这事儿，,0
9817,265,5,和平,于大妈，我可能给您提意见了啊,0
9818,265,6,和平,您这得罪人的事儿怎么老找我爸呀？,1
9819,265,7,和平,不是让他给您去收钱就是让他给您去当评委,0
9820,265,8,和平,您说那些老头儿老太太都挺在乎这个，评谁不评谁啊？,0
9821,265,9,和平,万一有几个没评上再闹出个三长两短的来,1
9822,265,10,于大妈,嗨，说哪去了这真是的,0
9823,265,11,于大妈,这不是让你们老爷子当评委他是候选人,0
9824,265,12,傅明,噢？个我能成嘛？,0
9825,265,13,于大妈,当然 成了！,0
9826,265,14,志国,咱们居委会管着好几百家哪家没个老人呐？,0
9827,265,15,志国,哪就轮到我爸了？,0
9828,265,16,于大妈,嗨，老人是不少啊可是要论素质呢？,0
9829,265,17,于大妈,政治素质啦，文化素质了，思想素质了那还没一个能超过老傅的呢大伙儿同意我这观点吧？,0
9830,265,18,傅明,您那是说的评优秀党员吧那个我在单位倒是一次都没有落过,0
9831,265,19,傅明,这个评选健康老人最重要的恐怕还得是身体素质吧,0
9832,265,20,于大妈,嗨，身体，那身体您也是数一数二的呀,0
9833,265,21,于大妈,你看，活了六十多岁啦愣不知道医院大门冲哪边儿开从打生下来就没见过大夫什么样儿,1
9834,265,22,志新,唉于大妈，您说的那是缺衣少药的贫穷山区,1
9835,265,23,志新,要不然就是愚昧落后信鬼信神有病找巫婆那种农村老年妇女,0
9836,265,24,志新,我爸不属于这种情况,0
9837,265,25,傅明,唉对对对，这几年我的身体是不行了就说看书学习吧我还没有志国坚持的时间长呢,0
9838,265,26,傅明,顶多熬上十六个小时也顶不住了,1
9839,265,27,傅明,要说锻炼身体呢我也没有志新跑得快,0
9840,265,28,傅明,这个不要说世界纪录距亚洲纪录都有一定的距离；,1
9841,265,29,傅明,再论唱歌我也没有和平的嗓子好；,0
9842,265,30,傅明,论跳高我都没有圆圆跳的高,0
9843,265,31,傅明,惭愧啊，说起来都觉得烫嘴,1
9844,265,32,志新,大妈您听听，我爸平常都用什么标准要求自己呀,0
9845,265,33,于大妈,就是啊,0
9846,265,34,傅明,而且，我还很年轻啊还不到七十岁啊,0
9847,265,35,傅明,要是您评选什么健美小姐健康男子什么的我倒可以试一试,1
9848,265,36,傅明,评选健康老人我看我这刚过中年的同志就不必参加了吧,0
9849,265,37,于大妈,话可不能这个说呀咱们这片儿比您岁数大的倒是还有可是都不如您身体好啊,0
9850,265,38,傅明,不会吧,0
9851,265,39,于大妈,那怎么不会？,0
9852,265,40,傅明,这个五单元的马老,0
9853,265,41,于大妈,啊？,0
9854,265,42,傅明,这个身体就恢复的很好嘛已经能够自己摇着轮椅上街啦,1
9855,265,43,傅明,还有前楼的杨老虽然那个手还有点儿弹棉花的意思可是已经看不出半身不遂的后遗症了,1
9856,265,44,于大妈,你瞧瞧这行么这个,0
9857,265,45,傅明,还有后楼的李老那个老年痴呆症已经好多了昨天虽然能够叫出他孙子的名字啦哈哈,1
9858,265,46,于大妈,可是他到现在还坚持着跟他老婆呀，叫江青！,1
9859,265,47,傅明,还有孙老嘛，现在虽然住在医院里,0
9860,265,48,傅明,可是体温已经下降到三十八度点二十了已经不咳嗽了,1
9861,265,49,傅明,我看是不是优先考虑这些同志啊？,0
9862,265,50,于大妈,老傅啊，比比他们再看看你这个名额你看给谁合适啊？,0
9863,265,51,傅明,这个我就不好说啦我就随时准备接受街道组织的安排吧,1
9864,265,52,于大妈,行！那就这样儿，你准备准备,0
9865,265,53,于大妈,明天我们在老年之家开个动员会你跟老郑俩人呐都发表个竞选纲领到时候呢群众投票也好有个依据啊,0
9866,265,54,傅明,怎么回事，这个老郑他也参加？,0
9867,265,55,于大妈,组织上决定啊这次是群众推荐民主推选,0
