ID,Dialogue_id,Utterance_id,Speaker,Sentence,Label
6014,156,6,和平,没听说过你挨那儿还有熟人啊你是不是常瞒着我带别人儿去呀你,1
6015,156,7,志国,谁常带人去呀我就是带我们单位的小赵小钱她们去过几回,1
6016,156,8,志国,小孙小李我根本没带着她们去过,1
6017,156,9,和平,你带她们去啊你都带她们去啊,1
6018,156,10,和平,你干脆把你们单位改妇产医院得了你,1
6019,156,11,志国,你看你我在单位大小也是个领导这计划生育是基本国策领导得亲自,0
6020,156,12,志国,那什么那以后我不抓了还不行了么,1
6021,156,13,和平,谁不让你抓呀让你亲自抓也不是说你就得亲自是不是啊,1
6022,156,14,志国,那行行行我以后不带她们去了我光带你一人儿去还不行吗,0
6023,156,15,和平,这还差不多啊 光带我一人儿去你还是让我多活两年吧你,1
6024,156,16,志国,我是说,0
6025,157,0,邻居保姆,你就这么把他们家支使得团团乱转,0
6026,157,1,保姆小张,也让他们知道知道我早先一个人干了多少活儿哟,0
6027,157,2,邻居保姆,看不出你觉悟提高得很快嘛,0
6028,157,3,保姆小张,姐妹们心里都闷得很为谁辛苦为谁忙,0
6029,157,4,邻居保姆,你出头的日子不会太远啦,1
6030,157,5,邻居保姆,哎你干什么你怎么又干上活儿了,0
6031,157,6,保姆小张,我的腰早好了老这么装着我心里不落忍,0
6032,157,7,保姆小张,俗话说得好假的就是假的总有一天会暴露出来,0
6033,157,8,邻居保姆,这工作刚展开几天你就坚持不下去了,0
6034,157,9,邻居保姆,你比当年的地下党可是差远啦,1
6035,157,10,邻居保姆,人家敌营18年都不带暴露身份的,1
6036,157,11,邻居保姆,要装病就给他装到底,0
6037,157,12,邻居保姆,干脆让他们家给你养老送终算啦,1
6038,157,13,保姆小张,小翠你是不知道这装病比得真病还难受,0
6039,157,14,邻居保姆,我怎么能不知道呢,0
6040,157,15,邻居保姆,我打小学一年级开始就装病我都装到现在啦,1
6041,157,16,邻居保姆,这装病有几个窍门儿我得教给你,0
6042,157,17,邻居保姆,装病首先要假装疼得满地乱打滚儿,1
6043,157,18,志新,别装啦一会儿我就让你满地打滚儿,1
6044,157,19,邻居保姆,小张  小张快拦着他,0
6045,157,20,志新,我们家小张都是你给教坏的我让你教,0
6046,157,21,保姆小张,志新哥 你打的是我,0
6047,157,22,志新,对不起 我打错人了,0
6048,157,23,志新,没错儿我打得就是你,1
6049,157,24,志新,你这没病装病害我拿个破轮椅推着你满屋转悠,0
6050,157,25,志新,我丢多大人不说我现多大眼呀,1
6051,157,26,邻居保姆,他打人他还有理啦,0
6052,157,27,邻居保姆,小张我们不在这儿做了我们去找别的工作,0
6053,157,28,保姆小张,唉 算啦小贾啊念你初犯这次就饶了你吧,0
6054,157,29,志新,唉得  谢谢小张姑奶奶,1
6055,157,30,志新,你原谅我我还没原谅你哪,1
6056,157,31,志新,坐下写检查深刻的检查,0
6057,157,32,志新,写完以后你把它交给,0
6058,157,33,志新,你先抄20遍再说,1
6059,158,0,和平,来，请进，请进,0
6060,158,1,李秘,总经理，我认出来了，就这小子,0
6061,158,2,王总,扯王八犊子呐那是个女的,1
6062,158,3,志新,哥儿几个来了,0
6063,158,4,和平,请坐，请坐，坐吧，您赶紧坐小张儿，倒茶去,0
6064,158,5,志新,来了我给哥儿几个拿烟去啊,0
6065,158,6,和平,我这弟弟，年轻不大懂事，您几位多包涵,0
6066,158,7,王总,还不懂事呢？他干的事儿可够邪乎的,0
6067,158,8,和平,他脑瓜子有时候死性,0
6068,158,9,王总,就这一点我们还绕不过他呐,1
6069,158,10,和平,您喝点儿水给那先生也端一杯,0
6070,158,11,和平,你们见过我弟弟？,0
6071,158,12,李秘,不见，没见过那哪行呢？我们认识,0
6072,158,13,李秘,刚开始，冷不丁的认错人了你跟你弟弟长得真像,0
6073,158,14,和平,我跟我弟弟长得不像啊我随我妈,0
6074,158,15,和平,我弟弟，那，那，他不是我弟弟,1
6075,158,16,李秘,真的你是长得像你妈是，真像,0
6076,158,17,和平,你见过我妈呀？,0
6077,158,18,李秘,刚才给俺们倒水的，那不是你妈吗？老像啦,1
6078,158,19,李秘,说真的，你随她,1
6079,158,20,和平,我随她？我随的着吗我,1
6080,158,21,志新,来来来，抽烟，抽烟,0
6081,158,22,和平,你们先忙着啊，我让我妈做饭去,1
6082,158,23,和平,我让小张儿做饭去,0
6083,159,0,傅明,嗨！绝了！,0
6084,159,1,和平,房租 66块5水电费 32块1,0
6085,159,2,和平,电话费87，那么贵呀？谁打长途了？,0
6086,159,3,傅明,哎呀简直是这个没治了,0
6087,159,4,和平,爸爸，爸爸您瞧什么书呢？怎么一惊一乍的？,0
6088,159,5,和平,不是好书您别瞧啊您这么大岁数您受得了这个么,0
6089,159,6,傅明,不要紧，我受的了,1
6090,159,7,和平,您受的了您就不管别人受的了受不了,0
6091,159,8,和平,岁数大了非让您吓出病来,0
6092,159,9,傅明,为什么书籍是人类最好的朋友呐确实让人聪明啊,0
6093,159,10,和平,您还嫌您自个儿不够聪明,1
6094,159,11,傅明,本来我觉得我还是够聪明的,1
6095,159,12,傅明,可是看了书以后我觉得还是有差距的嘛,0
6096,159,13,傅明,真是学海无涯艺无止境啊,0
6097,159,14,和平,您这是又瞅什么经典著作呐,0
6098,159,15,傅明,对对对，《推理小说经典名著选》,0
6099,159,16,傅明,和平啊,0
6100,159,17,和平,哎,0
6101,159,18,傅明,你看我将来准备发挥余热到公安局去当个侦探怎么样？,0
6102,159,19,和平,我倒是没意见就是不知道人家愿意不愿意收您,1
6103,159,20,和平,估摸着坏人您是一个也抓不着了好人您兴许能抓个三五个,1
6104,159,21,傅明,那就不少了嘛,0
6105,159,22,和平,是,0
6106,159,23,傅明,好人我抓他干什么？,1
6107,159,24,傅明,你小看我是不是？,0
6108,159,25,傅明,我告诉你，就我现在这个水平比他们专业的不在以下,0
6109,159,26,和平,是,0
6110,159,27,傅明,我出个题目考考你,0
6111,159,28,傅明,这个 好比说这个屋里有个女的自杀了,1
6112,159,29,和平,我知道了，这屋里就我一个女的您这是咒我呢,1
6113,159,30,傅明,哎  算了算了好比说这个屋里有个男的自杀了,1
6114,159,31,和平,这屋就您一个男的呀爸,1
6115,159,32,和平,您要有什么事儿您别想不开,1
6116,159,33,傅明,好好好！啊，不是这屋，是别的屋,0
6117,159,34,和平,别咱家别的屋现在没人呐,0
6118,159,35,傅明,你要急死我呀你,1
6119,159,36,傅明,噢那就不是咱们家  是别人家,0
6120,159,37,傅明,好比说别人家，有个女的自杀了,0
6121,159,38,傅明,这个门窗紧锁屋里看不到一点儿痕迹,0
6122,159,39,傅明,从现场看嘛，怎么看怎么像是上吊死的,1
6123,159,40,傅明,你猜猜，她到底是怎么死的？,0
6124,159,41,和平,门窗紧锁，还瞧不出一点儿痕迹？,0
6125,159,42,傅明,对对对对,0
6126,159,43,和平,怎么死的呀？,0
6127,159,44,傅明,猜不出来了吧，我告诉你,0
6128,159,45,傅明,她还真是上吊死的,1
6129,159,46,和平,您这不怎么样呀,0
6130,159,47,和平,得了，您也甭考我了啊我先给您出道题吧,0
6131,159,48,和平,您说咱家这月电话费怎么这么贵呀？,0
6132,159,49,和平,您先把这案给我破了,0
6133,160,0,老傅远房表姐,弟妹胡管家也在这儿呢,0
6134,160,1,胡学范,是 姑太太早太太这儿正跟我布置早餐呐,0
6135,160,2,胡学范,不知道您吃鸡蛋 是喜欢吃嫩的还是喜欢吃老的是两面煎呐是一面煎呐,0
6136,160,3,老傅远房表姐,随便吧,0
6137,160,4,老傅远房表姐,胡管家我看你耳朵是不是不太好啊,0
6138,160,5,老傅远房表姐,要不然刚才我弟妹跟你说事情的时候你干嘛离的那么近呐,1
6139,160,6,胡学范,没错儿 没错儿到底是姑太太 一看一个准儿,0
6140,160,7,胡学范,那行 二位您先在这儿歇着我去把叫他们叫起来都什么时候了还不起来,0
6141,160,8,老胡爱人,那我也去看看,0
6142,161,0,圆圆,就我们班那大胖子就没翻过去,0
6143,161,1,志国,你还说人家胖 你个大肉球,0
6144,161,2,圆圆,得了吧 你才大肉球,0
6145,161,3,志国,前滚翻得抱住脑袋,0
6146,161,4,和平,哎哎哎 你该说说你爸了啊,0
6147,161,5,志国,怎么了,0
6148,161,6,和平,怎么回事儿啊见天儿往居委会跑到了饭点儿也不知道回来,0
6149,161,7,志国,嗨 我爸就这脾气多少年了光知道工作不注意身体,0
6150,161,8,和平,这什么工作呀一个居委会几个老太太再加上一你爸能干出什么正经事儿呀,1
6151,161,9,志国,不干正经事儿干什么呀那依你那意思我爸跟一帮老太太整天不干正经事儿,0
6152,161,10,和平,我也没这么说呀,0
6153,162,0,燕红,干什么，干什么，你让人家看见算怎么回事儿啊？看你那臭不要脸的德行,0
6154,162,1,志新,坐下你说你是不是想彻底搅黄我娶媳妇儿这事儿，以便取而代之啊？,0
6155,162,2,燕红,别自我感觉太良好啊我告诉你，哪怕这世界上就剩下你一个男人，,0
6156,162,3,志新,别把话说那么绝这世界上剩我一个男人，你还不跟我携手并肩，面对大自然，跟野兽搏斗啊？,1
6157,162,4,燕红,剩下别人也许会是这样剩下你嘛，,0
6158,162,5,燕红,我只能先跟你搏斗完了再跟野兽搏斗,1
6159,162,6,志新,你既然别无所求，就别老跟这里边儿搅和了成不成,0
6160,162,7,燕红,我完全是因为不忍再看到无辜女青年被你成批残害,1
6161,162,8,志新,我残害谁了我？我发誓我每次谈恋爱都是认真的,0
6162,162,9,志新,我跟你说，你说我这岁数我容易吗我？你说那真好的，谁守身如玉地等着咱呢？,0
6163,162,10,志新,我跟你说，我真是这么想的除了你，兹是个全壳儿，我凑合着嫁个就完啦就求你高抬贵手，别再干涉我的恋爱自由了成不成？,0
6164,162,11,燕红,我干涉你？贾志新，从小到大你就没少干涉过我的恋爱自由这么些年我还没计较呢,0
6165,162,12,志新,真是新鲜，我干涉你？我巴不得你赶紧嫁出去就得了,0
6166,162,13,燕红,初三，4班的袁刚跟我谈朋友被人暴打了一顿，再也不敢理我了，这事是不是你找人干的？,0
6167,162,14,志新,我是保护你，为你好啊,0
6168,162,15,燕红,那，上高一的时候我跟咱们教体育的王老师通信,0
6169,162,16,燕红,被你报告了学校害得王老师调离，害得我在学校里抬不起头来，这也是保护我？,0
6170,162,17,志新,那当然啦，那姓王的是专门玩弄女性的坏人,0
6171,162,18,燕红,坏人？谁坏？听说后来王老师表现不错在监狱里被评为模范犯人还减了刑呢,1
6172,162,19,志新,抓起来了？,1
6173,162,20,志新,好好好那你怎么不说感谢我及时挽救了你，反而为此向我进行疯狂的反攻倒算啊！,0
6174,162,21,志新,你现在什么心理呀？你还不应该算是老姑娘吧？,0
6175,162,22,志新,我告诉你，老玉米不管你如何打击报复，我也绝不会低下高贵的头你破罐儿破摔还想把我也拉下水我告诉你，明儿我非找一优秀的，我让你开开眼,0
6176,163,0,圆圆,哎 朝阳叔叔,0
6177,163,1,孟朝阳,哎哟 贾小姐你怎么这么乖呀大星期天的一人跟家呆着,0
6178,163,2,孟朝阳,那家长同志们呢,0
6179,163,3,圆圆,我爷爷参加一老战友聚会我爸我妈参加一婚礼小桂阿姨今儿休息出去玩儿去了谁都不带我,0
6180,163,4,孟朝阳,那你中午饭怎么办呀,0
6181,163,5,圆圆,让我自己吃方便面,0
6182,163,6,孟朝阳,什么我大老远来了就让我吃方便面,0
6183,163,7,孟朝阳,我是说 他们怎么能这么欺负我们圆圆呢,0
6184,163,8,孟朝阳,没关系 朝阳叔叔陪你玩儿,0
6185,163,9,孟朝阳,我这就给你做好吃的去啊,0
6186,163,10,圆圆,你给我做还是我给你做呀,1
6187,163,11,孟朝阳,那当然是我给,0
6188,163,12,孟朝阳,实在不行干脆我带你外头吃去,0
6189,163,13,圆圆,唉 行啊,0
6190,163,14,孟朝阳,哟 2212速来我处不说好晚上么怎么又改中午了,0
6191,163,15,孟朝阳,圆圆 实在对不起啊朝阳叔叔有急事我晚上再陪你玩儿来,1
6192,164,0,孟朝阳,吃饭吃饭 进去走走走 吃饭去这孩子你说说,0
6193,164,1,圆圆,别理我 别理我烦着呢,0
6194,164,2,孟朝阳,你烦我就不烦啦谁爱理你呀,0
6195,164,3,孟朝阳,我要不是受大家的委托你不吃饭呀 我吃,0
6196,164,4,和平,圆圆坐下吃饭 这孩子,0
6197,164,5,傅明,圆圆 遇到一点小小的挫折怎么就不吃饭了呢,1
6198,164,6,傅明,我已经让你爸爸去学校了解情况去了看看这里面有没有什么误会,0
6199,164,7,圆圆,是,0
6200,164,8,圆圆,什么误会肯定老师成心跟我做对,0
6201,164,9,圆圆,我什么时候得过这成绩呀全班倒数第一还让不让我活了,0
6202,164,10,孟朝阳,她到底哪门考砸了这么要死要活的,0
6203,164,11,和平,作文小考 61分,0
6204,164,12,孟朝阳,我还当怎么了呢61分 不都及格了么要搁我小时候 我得乐一礼拜,1
6205,164,13,和平,嗯 我们圆圆从来都对自己高标准严要求,0
6206,164,14,孟朝阳,是唉 你说咱们圆圆平时这嘴挺能说的呀怎么就写不好这作文呢,0
6207,164,15,孟朝阳,肯定是他们老师偏心眼子你们等着 我把她废了就回来,0
6208,164,16,傅明,坐下胡闹嘛怎么动不动就杀人放火,0
6209,164,17,和平,爸您让他去 他也就嘴上说说,0
6210,164,18,傅明,嘴上说也不成学校那边我已经让志国去了解情况去了,0
6211,164,19,傅明,现在我们要从圆圆自己身上找找原因,0
6212,164,20,傅明,这个 她过去的作文我也看过几篇-确实水平不高    -唉,0
6213,164,21,傅明,胡编臆造 生拉乱扯缺乏指导嘛,0
6214,164,22,孟朝阳,您早说呀 缺乏指导您找我呀,0
6215,164,23,孟朝阳,我小时候那作文经常在我们班黑板报上发表指导个圆圆还不有富余,0
6216,164,24,孟朝阳,伯父 您就放心吧,0
6217,164,25,傅明,-你说你指导圆圆     -啊那我就更不放心了,1
6218,165,0,志新,还没睡呢？我来介绍一下这就是我常说的，莉达小姐,0
6219,165,1,和平,瞅瞅人做生意的，多会抓紧时间,0
6220,165,2,和平,我给您沏杯茶去吧？,0
6221,165,3,女骗子,别忙，嫂子，回头我自己来,0
6222,165,4,女骗子,喂，请问哪位杨先生，呼叫315啊？对，是我，在燕红咖啡屋附近,0
6223,165,5,女骗子,真的？火车票买到了？太好了,0
6224,165,6,女骗子,风声很紧呀,1
6225,165,7,女骗子,你另约个地儿，我去取票你呼我就行，就这么着,0
6226,165,8,傅明,志新，你看，人家“溜达”小姐到咱们家，,0
6227,165,9,和平,莉达,1
6228,165,10,傅明,事先，你也不打个招呼啊,0
6229,165,11,女骗子,我们，到别人家，一般都不打招呼，怕给人，,1
6230,165,12,女骗子,添麻烦,0
6231,165,13,和平,您瞧，我们都不知道，我们这家乱七八糟，都没归置,0
6232,165,14,女骗子,没什么，其实真乱的人家，你们还没有见过呢,0
6233,165,15,女骗子,上一回，我们去一家呀，这一撬门，,1
6234,165,16,傅明,什么？,0
6235,165,17,女骗子,就是因为家里太乱了老丢钥匙，所以只好天天撬门了,1
6236,165,18,和平,那得多麻烦呐得,0
6237,165,19,女骗子,撬惯了，也就不麻烦了,0
6238,165,20,女骗子,这一行吧，就讲究这个心灵手巧,1
6239,165,21,和平,难弄着呢，那个,0
6240,165,22,女骗子,志新啊，能带我参观参观你们家吗？,0
6241,165,23,和平,行啊，我带你去呀,0
6242,165,24,傅明,随便看，随便看和平啊，领她到各屋都去转转,0
6243,165,25,和平,行嘞，先去您那屋,0
6244,165,26,和平,有你什么事儿啊？回去,1
6245,166,0,志新,我说这位女同志啊现在是上班时间您别老占着本公司业务电话行不行？,0
6246,166,1,志新,你耽误多少生意呀,0
6247,166,2,和平,你别挂,0
6248,166,3,和平,我从来就没见着你做成过一笔生意,1
6249,166,4,和平,您这回又叫个什么公司呀？这业务电话还得使自个儿家的我说贾经理,0
6250,166,5,志新,贾总经理,1
6251,166,6,志新,这是我的名片请多关照,0
6252,167,0,于大妈,居民同志们关于健康老人的评比标准呢我就先说到这儿,0
6253,167,1,于大妈,下面的大家酝酿一个咱们这片儿的候选名单下个礼拜呀就要正式投票选举了,0
6254,167,2,燕红,唉于大妈，您把这套形式主义免了好不好？还有什么可酝酿的，咱们这片儿合乎评选标准的还能有谁呀,0
6255,167,3,志新,我看压根儿就不用酝酿大伙儿也知道该评谁,0
6256,167,4,于大妈,谁呀？,0
6257,167,5,志新,那还用问么？,0
6258,167,6,志新,就是大家伙儿无限敬仰无比爱戴的我，爸,1
6259,167,7,燕红,什么？你爸？那我爸往哪儿搁啊？,0
6260,167,8,燕红,我就不信，这么标准的一个健康老人,0
6261,167,9,燕红,天天在楼下晃悠左邻右舍的，能熟视无睹？,1
6262,167,10,燕红,嘁，你们瞧瞧这位郑老人啊，气色体质举止风度,1
6263,167,11,燕红,哪儿样儿不在咱们本地区拔头份呢？,0
6264,167,12,燕红,我怀疑这份评选标准压根儿就是参考他的标准制定的,0
6265,167,13,志新,没错儿没错儿我一看这标准就是参照你爸制定的,0
6266,167,14,志新,要是参照我爸这标准不能定这么低,1
6267,167,15,志新,照我爸这条件这标准就是残疾超级老人的标准,1
6268,167,16,于大妈,唉，你说可是说啊对这标准可不能怀疑,0
6269,167,17,于大妈,这就等于是攻击街道的正确领导,0
6270,167,18,志新,唉唉于大妈，我对不起我说走嘴了,1
6271,167,19,志新,我那意思就是我爸条件好,0
6272,167,20,燕红,你爸条件是不错，你们家要是搬别地儿也许能选上谁让他偏偏跟我爸住在一块儿,0
6273,167,21,燕红,咱要不把最好的拿出去全区人民也不答应啊是不是？,0
6274,167,22,燕红,对不对，于大妈？,0
6275,167,23,于大妈,老傅老郑的条件呀都不错我看呐，可以平等竞争嘛,0
6276,167,24,志新,不是竞争也得有对手啊,0
6277,167,25,志新,你让我爸跟郑伯伯竞争这不明摆着欺负他么,1
6278,167,26,燕红,你要话这么说傅伯伯我也欺负您一回吧,0
6279,167,27,燕红,来啊，怕谁啊？,0
6280,167,28,志新,你还叫板是不是啊？,0
6281,167,29,志新,来，咱先说政治上,0
6282,167,30,燕红,嗯！,0
6283,167,31,志新,我爸十七岁投身革命,0
6284,167,32,燕红,那不错，我爸十六岁参加抗日,1
6285,167,33,志新,我爸一开头儿就参加了共产党,0
6286,167,34,燕红,我爸后来也参加共产党啦,1
6287,167,35,志新,开始呢？开始你爸加入的是国民党,0
6288,167,36,燕红,对呀对呀，没错国民党给吃给喝高官厚禄都没能收买我爸,0
6289,167,37,燕红,他老人在紧急关头毅然起义弃暗投明反戈一击英雄啊！老郑！,1
6290,167,38,志新,那不是我爸深入虎穴策反你爸，要不然你爸还能有今天？,0
6291,167,39,燕红,那不是我爸深明大义从善如流恐怕你爸也是有去无回，你爸能有今天？,1
6292,167,40,志新,评选健康老人身体是第一位的,0
6293,167,41,志新,我爸身体好，混身上下没毛病,0
6294,167,42,燕红,我爸筋骨硬，从里到外都正常,0
6295,167,43,志新,我爸牙口好六十多岁了没事儿就好嚼个铁蚕豆什么的,1
6296,167,44,志新,好几个厂家牙膏厂都想拿他这牙做广告使几个濒临破产的企业起死回生！,1
6297,167,45,燕红,我爸，快七十的人眼睛还这么亮蚊子打眼前一过能分的出公母儿！,1
6298,167,46,燕红,研究所几回想拿他搞科研，彻底扭转我国人体科学的落后局面！,1
6299,167,47,志新,我要是不解释，别人老拿我爸当我哥,1
6300,167,48,傅明,志国，志国有我这么老么？,0
6301,167,49,志新,这不是形容您年轻么,0
6302,167,50,燕红,我要是不说明啊别人老以为是我男朋友,1
6303,167,51,老郑,你要是敢找我这么大岁数的男朋友我就不让你进家门儿,1
6304,167,52,燕红,我这不夸您长得少兴嘛,0
6305,167,53,志新,我爸老有所为，各种组织没少参加,0
6306,167,54,燕红,我爸老有所用，政协里数他体验最多,0
6307,167,55,志新,我爸，我爸比你爸高,0
6308,167,56,燕红,我爸比你爸瘦,0
6309,167,57,志新,我爸，爸您还有什么优点来着？,0
6310,167,58,傅明,不能光只讲优点，缺点也要讲嘛,0
6311,167,59,傅明,来来来你们二位先坐下,0
6312,167,60,傅明,这个，说到缺点我的缺点还是比较严重的,0
6313,167,61,燕红,对！,0
6314,167,62,傅明,比如说在体育锻炼方面我就光顾自己锻炼很少想到要去帮助别人,0
6315,167,63,傅明,这个模范带头作用起的很不够,0
6316,167,64,傅明,每一次约郑千里同志去打球下棋他都百般地推托,0
6317,167,65,傅明,而我呢又没有能很好的坚持不应该呀,1
6318,167,66,老郑,哪回他都耍赖，谁愿意跟您玩儿啊！,1
6319,167,67,傅明,还有这个在培养良好生活习惯方面我对老郑的关怀爱护的也很不够,0
6320,167,68,傅明,大家都知道老年人应该早睡早起而有一次深夜五点钟我还看见郑千里同志一个人在大街上溜溜达达,0
6321,167,69,傅明,这个，我只是轻描淡写地说了他几句没有狠狠地批评他，不应该呀,1
6322,167,70,老郑,谁夜里出来溜达？我那是早晨起来锻炼呐,1
6323,167,71,傅明,特别是，在克服不良嗜好方面,0
6324,167,72,傅明,大家看评选标准第九条健康老人须在日常生活当中无不良嗜好,0
6325,167,73,傅明,而郑千里嗜酒成瘾酗酒成性大家都知道吧从而使他自动就丧失了这次竞选健康老人的资格,0
6326,167,74,傅明,而我又没有及时地教育他挽救他痛心呐，朋友们,1
6327,167,75,老郑,我呀是喜欢喝两口可是酒啊要是喝的适量的话还能起到化血化瘀的作用，这个嗜好啊也还有利有弊吧？,0
6328,167,76,燕红,对,0
6329,167,77,老郑,总比傅明同志那有百害而无一利的那嗜好要强多了吧？,0
6330,167,78,老郑,那才叫不良嗜好呐！,0
6331,167,79,傅明,我有什么不良嗜好？你在大家面前说清楚,0
6332,167,80,老郑,唉，大家有目共睹啊----抽烟而且是嗜烟如命,0
6333,168,0,和平,哎 家里有人吗,0
6334,168,1,和平,嘿 这头套真不错嘿,1
6335,168,2,和平,呦 爸,1
6336,168,3,和平,哎呦,0
6337,168,4,傅明,哎呀 这不一样就是不一样,1
6338,168,5,傅明,我这会儿就觉得我起码年轻了有十岁,1
6339,168,6,和平,你瞅你刚美美容您就年轻十岁,0
6340,168,7,和平,您要再整整容您还得年轻十岁,0
6341,168,8,傅明,吼吼 这个里外里就是二十岁呀,1
6342,168,9,和平,那可不,0
6343,168,10,傅明,这简直就是又活了一次嘛,1
6344,168,11,和平,那可不,0
6345,168,12,和平,您想您从六十多变成四十多,1
6346,168,13,和平,您二十多年您能干多少工作啊您不为自各儿您也是为国家呀,1
6347,168,14,和平,是不是,0
6348,168,15,傅明,听你这么一说啊这整容还真是有点意思,0
6349,168,16,和平,有点儿意思意思大啦,0
6350,168,17,和平,从您个人来说,0
6351,168,18,和平,您四十多岁正当年我婆婆也去世啦,0
6352,168,19,和平,多少女同志还不由着您随便挑,1
6353,168,20,傅明,这个,0
6354,168,21,和平,爸 爸,0
6355,168,22,傅明,这个问题我没有考虑,0
6356,168,23,和平,用不着您考虑到时候她们都上赶着追您,1
6357,168,24,圆圆,妈您看我怎么样,1
6358,168,25,圆圆,我起码长大十岁,1
6359,168,26,和平,长大,0
6360,168,27,和平,不是 你要干吗呀,1
6361,168,28,圆圆,我是不是应该考虑一些个人问题,1
6362,168,29,和平,我揍死你我,1
6363,168,30,和平,我告诉你啊,0
6364,168,31,和平,今儿特殊让你凑凑热闹,0
6365,168,32,和平,下回你再敢化妆我打死你我,0
6366,168,33,保姆小桂,大姐 你看俺呢俺觉得自己也长大了十岁,0
6367,168,34,保姆小桂,不中,0
6368,168,35,保姆小桂,那俺年轻了十岁,0
6369,168,36,保姆小桂,也不中,0
6370,168,37,保姆小桂,俺还是现在这岁数,1
6371,168,38,保姆小桂,大姐 你看俺漂亮多了是不是,0
6372,168,39,和平,是是,0
6373,169,0,居委会陈大妈,哎哟 哎哟 哎哟累死我了,0
6374,169,1,居委会陈大妈,弄这点儿破烂我跑了八个旧货市场噢,0
6375,169,2,居委会陈大妈,哎呀我就纳闷你们和平这病怎么这么邪性啊,0
6376,169,3,傅明,和平的病固然邪性,0
6377,169,4,傅明,我看那个杨大夫的治疗方案啊更邪性,1
6378,169,5,志国,我倒觉得这方案可行,0
6379,169,6,志国,您想啊和平这二十年的事都想不起来了咱不得一点一点帮她回忆啊,0
6380,169,7,居委会陈大妈,是啊,0
6381,169,8,傅明,回忆就回忆吧,0
6382,169,9,傅明,干嘛非得把这个屋子给折腾成这个样子嘛,0
6383,169,10,志国,这不得顺着她来吗,0
6384,169,11,志国,不把它放在那个特定的历史环境当中去,0
