ID,Dialogue_id,Utterance_id,Speaker,Sentence,Label
2964,73,21,李秘,给你发工资？俺们仨月都没开了,1
2965,73,22,王总,你是敬酒不吃吃罚酒咋的？老胡啊，在这旮呢，为民除害的时候到了,0
2966,73,23,李秘,收拾他,0
2967,73,24,志新,兄弟，我可练过,0
2968,73,25,大个儿,大姐，别别别，别拿棍子，别打，别打大姐，有话好说,1
2969,73,26,志新,我姐姐，人送外号“和平女侠”,1
2970,73,27,志新,跟这儿动土不想缺胳膊短腿儿，赶紧滚蛋,0
2971,73,28,王总,哎呦，我的妈呀我咋那命苦呢？,1
2972,73,29,王总,这骗子那片子拿着把我们厂五万元的钱都给骗走了,0
2973,73,30,王总,你说盘条来不了我们厂到期交不出货就得垮了,0
2974,73,31,王总,那乡亲弄俩钱容易吗？就是啊到时候我怎么向他们交代呀？,0
2975,73,32,王总,那贾，假贾志新，真他妈坑死人啦,0
2976,73,33,李秘,啥也别说了，眼泪哗哗流,1
2977,73,34,王总,咱们仨人儿啊整顿饱饭吃，然后手拉手撞火车头去,1
2978,73,35,志新,别哭了，别哭了,0
2979,73,36,志新,说说，要多少盘条啊？,0
2980,74,0,宝财,凤姑  凤姑  张凤姑 张凤姑，,0
2981,74,1,宝财,怎么搞的房门没有锁，人呢嘛！,0
2982,74,2,宝财,许是我凤姑妹妹出去买菜去了,0
2983,74,3,宝财,随便坐反正也不是外人,1
2984,74,4,春花,我就知道你跟你那凤姑妹子不是外人！,0
2985,74,5,宝财,我们是纯洁的男女关系,1
2986,74,6,宝财,我比她大十多岁照着老辈份她得管我叫声舅舅,1
2987,74,7,春花,她在包工队我就看你俩眉来眼去的,0
2988,74,8,春花,舅舅搂着外甥女儿舒服一会儿是一会儿！,1
2989,74,9,宝财,我说春花你怎么进城不到半年学的是又反动又黄色！,1
2990,74,10,春花,我反动？我黄色？,0
2991,74,11,宝财,我不是准备朝她借点儿盘缠就走么要不然我绝对不对来找她。,0
2992,74,12,宝财,坐着，我给你弄点儿茶喝,0
2993,74,13,春花,他家好有钱哩,0
2994,74,14,宝财,哎呀，这叫什么有钱？我看你是真没有见过真正有钱人,0
2995,74,15,宝财,像现在这个行市这家人顶多算个贫下中农,1
2996,74,16,宝财,我看我凤姑妹妹在这家肯定受了不少委屈,0
2997,74,17,宝财,茶不好对付着喝一口,1
2998,74,18,春花,宝财哥，我肚子不对劲！,0
2999,74,19,宝财,怎么不对劲，反应这么快这家有茅房自个儿找去,1
3000,74,20,春花,两天没吃饭了我上那儿干什么？我是肚子饿咧,0
3001,74,21,宝财,这可难办了，你说我们兜兜里没有钱到什么地方吃饭人家不都得叫警察,0
3002,74,22,宝财,等我凤姑妹妹回来以后我跟她商量一哈子，兴许这家人就留我们吃顿便饭,0
3003,74,23,春花,我肚子可等不了干脆甭等人家留我们，我们主动先吃点儿,0
3004,74,24,宝财,中！吃点儿就吃点儿反正不是外人我做主了！,1
3005,75,0,傅明,唉，和平，这位同志是干什么的。,0
3006,75,1,小凡,要饭的吧？,0
3007,75,2,志国,别胡说，现在哪能要饭呐，,0
3008,75,3,志新,就是，都改要钱了嘛。,0
3009,75,4,傅明,要真是这种情况赶紧把他打发走,0
3010,75,5,傅明,别把咱们大好形势给耽误了,1
3011,75,6,志国,我跟您凑凑，,0
3012,75,7,和平,瞧你们把人家想的这么庸俗人家不要钱,0
3013,75,8,志新,要人哪？,1
3014,75,9,志新,这可就更难办了你是有主儿了，圆圆还小只能把小凡打发给他啦？,1
3015,75,10,小凡,你别来劲啊今晚上作恶梦我可跟你没完,0
3016,75,11,傅明,和平，此人到底是干什么的？,0
3017,75,12,和平,据他自个儿讲啊是个有名儿的发明家。,0
3018,75,13,志国,啊？有这模样儿的发明家吗这是明目张胆攻击党的知识分子政策呀这是,1
3019,75,14,和平,人不可貌相,1
3020,75,15,和平,他因为在当地呀长期受压制受迫害因人为阻挠诸多科学发明成果无法申请专利以至于沦落到现在这地步。,0
3021,75,16,傅明,噢，是个落难秀才,0
3022,75,17,和平,唉,0
3023,75,18,小凡,唉嫂子，这发明家你打哪儿捡的,1
3024,75,19,小凡,要是有富余的的？明儿我也捡一个，替我来考试。,1
3025,75,20,和平,哪儿那么好捡的？可遇不可求，全凭巧劲儿。,0
3026,75,21,和平,刚才呀，我一走进楼道就觉着踩着一个软软呼呼的东西,1
3027,75,22,和平,就听见，嗷，那么一声，,0
3028,75,23,志新,唉，这声儿可不像是人叫唤呢,1
3029,75,24,和平,正是这位纪同志在咱楼梯拐角儿处静卧思考呐,0
3030,75,25,和平,我一脚正踩在人家小肚子上，,1
3031,75,26,志新,不是你说这么热闹敢情是一倒卧呀讹上你了吧,0
3032,75,27,和平,人家这有文化的倒卧那就是不一样,0
3033,75,28,和平,人家春生还直个劲给我道对不起，说躺的不是地方妨碍我脚落地了,1
3034,75,29,和平,还给我讲了他的不幸。,0
3035,75,30,和平,呦，春生，甭着急，你慢慢吃,0
3036,75,31,季春生,大姐，我这么吃觉着不踏实，,0
3037,75,32,和平,咳，甭客气，就跟在自个儿家一样,0
3038,75,33,季春生,不是客气，您家有蒜吗？,1
3039,75,34,和平,有，在厨房呢。厨房那窗户上挂着呢。啊，自个儿拿，,0
3040,75,35,小凡,吃的还挺全呼。,0
3041,75,36,傅明,唉，和平啊，他没向你提什么要求吧？,0
3042,75,37,和平,没有。他说他过得很好也就是～三天没吃东西，八个月没洗澡,0
3043,75,38,和平,不记得上回在屋里睡觉是哪年的事了,1
3044,75,39,志国,合着看准咱家是免费饭店了,1
3045,75,40,和平,志国你别这么说。是我把人家请进来的,0
3046,75,41,和平,人家春生为执着追求风餐露宿无家可归为富国强民造福子孙甘当倒卧,1
3047,75,42,和平,咱们能为人家干点什么呢不就是给人家一顿饱饭吃，舍人一杯热水喝吗咱们不帮谁帮？,0
3048,75,43,傅明,说的对,0
3049,75,44,和平,唉！,0
3050,75,45,傅明,关心群众疾苦是我党的优良传统,0
3051,75,46,和平,对！,0
3052,75,47,傅明,虽然改革开放传统不能丢啊,0
3053,75,48,志国,唉！对对对对说咱们这么做有扶贫的性质，甚至有赈灾的意义也不为过,0
3054,75,49,志新,唉唉唉唉唉～就别再往高拔啦,0
3055,75,50,志新,就赏人一顿饺子就找着大款的感觉啦咱们这充其量叫穷帮穷,0
3056,75,51,和平,出力多少，那也是个阶级感情当然啦，真正解决他这问题还得靠上信访站,0
3057,75,52,和平,呦，春生，着什么急呀，吃饱为止,0
3058,75,53,季春生,实在是不能再吃了,0
3059,75,54,季春生,没了。,1
3060,75,55,小凡,啊？,0
3061,75,56,志新,二百多全着进去了,1
3062,75,57,志新,不是你不怕撑死你！？,1
3063,75,58,季春生,没有敢使劲吃啊,0
3064,75,59,小凡,爸！一礼拜全白盼了！,0
3065,75,60,和平,得！我们改吃挂面啦，啊，春生,1
3066,75,61,和平,你一下子吃那么多饺子肯定叫渴，到屋里盛碗汤喝去,0
3067,75,62,季春生,不渴，阳台上那两瓶啤酒我给干了。,0
3068,75,63,志新,你还真不拿自个儿当外人，这事儿怨我早知道您好喝会儿，我应该早早吩咐小张把凉菜给您端上去,0
3069,75,64,季春生,您是说冰箱里那肉皮冻吧,0
3070,75,65,季春生,吃了。味道不错再多搁点香油就更好了。,1
3071,75,66,和平,唉，唉，春生啊，我给你介绍介绍啊这位是我公公傅明同志,0
3072,75,67,季春生,呵呵呵,0
3073,75,68,和平,这位是我爱人志国。,0
3074,75,69,季春生,呵呵呵,0
3075,75,70,和平,这位是我弟弟志新,0
3076,75,71,季春生,呵呵呵,0
3077,75,72,和平,这位呐是我妹妹小凡,0
3078,75,73,季春生,捏，,1
3079,75,74,和平,圆圆呢？圆圆,0
3080,75,75,志国,唉唉唉，不叫也罢，省着吓着孩子,1
3081,75,76,季春生,见过了，都见过了就不都一一握手了，来日方长。,0
3082,75,77,傅明,志国啊，你领他去洗个澡，完了就，,0
3083,75,78,季春生,唉，老同志，您的热心我感谢,0
3084,75,79,季春生,可是，洗完澡之后再给轰出去露宿街头我容易感冒,1
3085,75,80,傅明,谁轰你啦？,0
3086,75,81,傅明,这样吧，你要是能凑合就跟志新啊在这客厅里先，对付一宿,0
3087,75,82,和平,唉,0
3088,75,83,季春生,有富余的席梦思吗？,1
3089,75,84,志新,我还睡行军床呢凑合着睡沙发吧你就,0
3090,75,85,和平,洗个热水澡，啊？把一身儿脏衣服脱了,0
3091,75,86,和平,唉，打这边走,0
3092,75,87,小凡,完啦完啦，今儿晚上这恶梦我是非作不可了二哥这一宿你可得提高警惕,0
3093,75,88,志新,那是那是，咱家好容易置办这么点家业不易,0
3094,75,89,志新,不就是睁一只眼避一只眼睡觉吗，会,1
3095,75,90,傅明,这革命成功都这么些年了还得保卫胜利果实，,0
3096,76,0,和平,吓死我了,0
3097,76,1,志国,没事儿,0
3098,76,2,和平,我告诉你啊，赶紧把雨披给我拿出来今天听天气预报有雨,0
3099,76,3,志国,怎么了这是？怎么了？,0
3100,76,4,和平,鞋里边儿有耗子,1
3101,76,5,于大妈,怎么了？怎么了？哪儿有耗子？,0
3102,76,6,于大妈,我可什么也没看见啊,1
3103,76,7,傅明,耗子嘛干什么嘛你们这是？,0
3104,76,8,和平,大妈，没耗子,0
3105,76,9,于大妈,我可听你喊耗子我才过来的,0
3106,76,10,志国,没，没,0
3107,76,11,和平,我喊志国呢我给他起个小名儿，叫耗子,1
3108,76,12,和平,这不是我要上班去了嘛，有个告别仪式总得，简单拥抱一下,1
3109,76,13,和平,十多年了，没间断过，没间断过,1
3110,76,14,于大妈,也是老夫老妻了，还坚持着呢？,1
3111,76,15,和平,真不好意思，让您瞅见上面儿不是说要夫妻团结吗？,1
3112,76,16,于大妈,那倒是，那倒是,0
3113,76,17,于大妈,那好吧，既然你们家没耗子啊这红旗就先挂你们家吧,0
3114,76,18,于大妈,慢点儿，别挂反喽,0
3115,77,0,孟朝阳,南高北低南为阴 阴气盛北为阳 阳气止凶灾病邪不断 大吉大利被阻所谓局阴宅是也,0
3116,77,1,孟朝阳,呜 呜,1
3117,77,2,和平,朝阳兄弟除了搬家还有什么别的化解之道没有啊,1
3118,77,3,孟朝阳,且慢待我上神听听大仙是怎么说的,0
3119,77,4,和平,唉 您听听,0
3120,77,5,孟朝阳,啊嚏,1
3121,77,6,圆圆,哟 朝阳叔叔您感冒了,0
3122,77,7,傅明,这叫神仙附体解放前我见得多了我要装比他装的还像,1
3123,77,8,孟朝阳,天灵灵地灵灵本是皇天第一名听说你家出了事儿我不远万里来到你家中啊啊,1
3124,77,9,孟朝阳,我请的这是白衣仙人,0
3125,77,10,志国,白衣仙还不远万里我听着怎么有点白求恩那意思,1
3126,77,11,孟朝阳,我一路上走的急匆匆脚下的大泡红通通一块猪肉十斤整一百个鸡蛋不挂零啊啊,1
3127,77,12,和平,唉唉 兄弟不是说不要钱嘛怎么要这么些东西啊,0
3128,77,13,孟朝阳,这是程序都得这么唱师傅就这么教的啊唱不唱在我 给不给在您,0
3129,77,14,孟朝阳,下边该什么词了对了 该诗朗诵了,1
3130,77,15,孟朝阳,赫赫扬扬 日出东方大仙在此 尽扫不详口吐三味之火眼放如日之光捉妖使天篷元帅破鬼用阵杀金刚尔等妖魔鬼怪 快快来此受降无谓言之无义 省得我动刀动枪降妖伏怪 大吉大祥急急如律令啰,1
3131,77,16,圆圆,朝阳叔叔念的真好听赶明儿教教我,1
3132,77,17,孟朝阳,-别打岔好不好    -去忘了词儿你负责呀,0
3133,77,18,孟朝阳,下边儿该是对了 我该正式捉鬼了,0
3134,77,19,孟朝阳,我乃东海一壮士今日捉鬼到傅家鬼呀鬼你在哪里,0
3135,77,20,傅明,哼,1
3136,77,21,志国,哼,1
3137,77,22,志国,爸 这大神儿跳的怎么样啊,0
3138,77,23,傅明,不怎么样顶多也就是乡镇一级的巫婆水平都进不了县城的,1
3139,77,24,孟朝阳,鬼呀鬼 你在哪里,0
3140,77,25,保姆小桂,唉唉 不是俺呀,1
3141,77,26,圆圆,小桂阿姨 这又没说是你你怕什么呀,0
3142,77,27,和平,你说这孩子这事儿给她吓的,0
3143,77,28,孟朝阳,鬼呀鬼,1
3144,77,29,和平,啊 你瞅他吓唬我,0
3145,77,30,孟朝阳,你在哪里,1
3146,77,31,圆圆,啊 朝阳叔叔 又不是我你别冲我来呀,0
3147,77,32,孟朝阳,我也没说是你让我再好好测一测,0
3148,77,33,圆圆,啊 你别过来 我告诉你,0
3149,77,34,孟朝阳,不做亏心事 不怕鬼叫门圆圆 你就都说了吧,0
3150,77,35,圆圆,朝阳叔叔可都是为了你 您怎么冲我来呀,1
3151,77,36,孟朝阳,我一猜就是你可是我要不把你出卖了怎么显出老夫我的捉鬼手段呐,1
3152,77,37,和平,唉唉 朝阳兄弟那鬼逮着没有啊,0
3153,77,38,孟朝阳,圆圆 你快快说了吧,0
3154,77,39,和平,说,0
3155,77,40,圆圆,我 我我坦白呀 我坦白,0
3156,77,41,和平,怎么啦 怎么啦 怎么啦,0
3157,77,42,孟朝阳,天机不可泄露,0
3158,77,43,傅明,朝阳 你也不必说了我早都看明白了,1
3159,77,44,孟朝阳,啊,1
3160,78,0,傅明,啊啊 对对对对一切都很顺利接到家里来吃了饭 洗了澡现在正在客房休息呐,0
3161,78,1,傅明,志新呐你听我跟你说啊我把你的优点向她做了一个非常全面的介绍啊 别人呐别人他们都不管主要是我主要是我,1
3162,78,2,圆圆,主要是我,0
3163,78,3,和平,唉唉说谁呀这是,0
3164,78,4,傅明,什么候董事长的女儿你已经向她表示了那个意思你是说她更合适,0
3165,78,5,傅明,让我们做一做小任姑娘的工作不让她再纠缠你了,0
3166,78,6,傅明,啊志新你怎么真是,0
3167,78,7,和平,怎么了,0
3168,78,8,志国,出什么事了,0
3169,78,9,傅明,志新在他们公司啊又认识一个候董事长的女儿,1
3170,78,10,傅明,他觉得小任姑娘还是不大合适让我们把志新的缺点集中地向她做一个介绍让她能够自己打消那种念头这不是朝三暮四嘛,0
3171,78,11,和平,真是,0
3172,78,12,傅明,我不管了,0
3173,78,13,和平,我也不管了,0
3174,78,14,傅明,他还说,0
3175,78,15,傅明,最近呐他又发了一笔补助费大概有几千块钱他说他留着也没有用扔了又怪可惜了的他准备随便给我们家里某个人,1
3176,78,16,志国,爸这事吧我是这么考虑的啊这个恋爱自由么是吧志新要是真不愿意跟小任姑娘好呢咱也不能强迫呀对不对,0
3177,78,17,志国,如果小任姑娘能够主动打消这个念头也免去了心灵上的痛苦咱们也做件好事啊咱们,1
3178,78,18,和平,对 对 对,0
3179,78,19,傅明,噢 这也是好事啊,0
3180,78,20,和平,强扭的瓜强扭的瓜不甜呢,0
3181,78,21,志国,-就是          -对呀,0
3182,78,22,圆圆,而且可以促成我二叔和那位小姐的好事好上加好嘛,0
3183,78,23,志国,对呀锦上添花嘛,0
3184,78,24,和平,雪上加霜嘛,1
3185,78,25,圆圆,对对不对,0
3186,78,26,傅明,既然这样那就还是我先去,0
3187,78,27,和平,别别,0
3188,78,28,圆圆,我去 我去,0
3189,78,29,小任姑娘,大家好怎么都不说了你们今天向我介绍了志新的情况我觉得很惊讶这个世界上还有这么多人能喜欢他赞美他,0
3190,78,30,傅明,小任姑娘刚才因为时间的关系,0
3191,78,31,和平,唉 对对,0
3192,78,32,傅明,我们光说了志新的优点还没有来得及说他的缺点其实志新这个缺点呀也是相应严重的,1
3193,78,33,傅明,这个游手好闲好吃懒做华而不实虚头八脑的反正啊谁嫁了他谁倒霉,1
3194,78,34,小任姑娘,伯父您怎么这么说您儿子呀,0
3195,78,35,和平,唉 小任姑娘我公公他说的可一点儿都不夸张我告诉你,0
3196,78,36,和平,这志新呐没法儿说得亏你还没落入他那魔爪啊你现在跑还来得及,1
3197,78,37,小任姑娘,大姐这么严重啊,0
3198,78,38,圆圆,比这还严重呢我可不能因为他是我二叔我就向着他我二叔做那坏事三天三夜都说不完,1
3199,78,39,小任姑娘,他都干过什么坏事啊,0
3200,78,40,志国,哎哟 多了吃喝嫖赌抽坑蒙拐骗偷踢寡妇门刨掘户坟,1
3201,78,41,志国,他为什么去海南啊那是因为北京西城分局把他通缉在案呐,1
3202,79,0,和平,怎么办吧，这孩子说话就回来了赶紧想想辙吧,0
3203,79,1,志国,嗳，偏偏她每门儿都考过了九十五分,0
3204,79,2,志新,就盼着今儿这门能不及格,1
3205,79,3,和平,唉，唉别介儿，都什么时候了你还逗咳嗽，,0
3206,79,4,圆圆,你们猜，多少分儿，,0
3207,79,5,和平,多少分啊,0
3208,79,6,圆圆,一百分儿！,1
3209,79,7,圆圆,北京的朋友们，你们喜欢不喜欢,1
3210,79,8,志国,喜欢喜欢喜欢,1
3211,79,9,圆圆,妈，快点儿来教我化妆爸，负责把家里环境布置一下二叔，赶快把个人卫生重搞一遍,0
3212,79,10,圆圆,爷爷是怎么也倒赤不出来了今晚就不要出席了好吗  乖，,1
3213,79,11,圆圆,快给我找出我的连衣裙粉红色是阿荣最喜欢的颜色。,0
3214,79,12,和平,这给怎么办呐  现在要告诉孩子真相，这孩子还不立马得精神崩溃啊,0
3215,79,13,和平,唉唉唉，你溜啊！,0
3216,79,14,志新,我直接去找张国荣！,0
3217,80,0,傅明,这是干什么呀,0
3218,80,1,和平,志新放出来好几天了我们想请胡伯伯跟胡伯母啊过来吃顿饭,0
3219,80,2,傅明,请他们干什么,0
3220,80,3,傅明,志新放出来是海南方面把问题搞清楚了嘛,0
3221,80,4,傅明,他们总经理开车撞的人志新当然要放啦,0
3222,80,5,傅明,跟他胡学范有什么关系,1
3223,80,6,和平,爸，您怎么过河拆桥啊,0
3224,80,7,傅明,别人的桥，可以不拆,0
3225,80,8,傅明,他的桥我还非拆不可,1
3226,80,9,傅明,这个事件办成了应该感谢政府感谢党嘛,0
3227,80,10,傅明,用的着感谢胡学范,1
3228,80,11,傅明,都是你们，非得让我去求他,0
3229,80,12,和平,反正我们把人请来了,0
3230,80,13,傅明,请来了怎么样你看他敢来么,0
3231,80,14,傅明,他怎么进来我就把他怎么扔出去！,0
3232,80,15,和平,人家来了,0
3233,80,16,和平,我瞅瞅你怎么把人扔出去，我瞅瞅,1
3234,80,17,傅明,你以为我不敢我今天就让你们开开眼！,0
3235,80,18,傅明,老胡,1
3236,81,0,圆圆,哎 爷爷你干嘛呀我看一半呢我,0
3237,81,1,傅明,和平说话就要到客厅来你先回避一下,1
3238,81,2,傅明,我们大人有话说,0
3239,81,3,圆圆,你们说你们的我又不是外人,0
3240,81,4,圆圆,您别忘了啊 她可是我妈,0
3241,81,5,傅明,怎么是我忘了明明是她忘了嘛,1
3242,81,6,傅明,圆圆 你不要着急,0
3243,81,7,傅明,这几天啊你妈正在跟你爸谈恋爱,1
3244,81,8,傅明,而且进展得很顺利,0
3245,81,9,傅明,估计你出头的日子不远了,1
3246,81,10,圆圆,那我什么时候才能管我妈叫妈呀,1
3247,81,11,傅明,这个这个要看你妈和你爸关系进展的程度,1
3248,81,12,傅明,不过我可以告诉你一个好消息,0
3249,81,13,傅明,昨天你妈已经同意嫁给你爸了,1
3250,81,14,傅明,什么话嘛这叫,1
3251,81,15,圆圆,算了吧就算我妈今儿个就嫁给我爸等我想起我起码还得一年,0
3252,81,16,圆圆,我还是来路不明吧我,1
3253,81,17,圆圆,我就是不知道我管她叫阿姨还是叫姐姐,1
3254,81,18,傅明,哎 那就先叫嫂子,1
3255,82,0,保姆小桂,来啦来啦,0
3256,82,1,计生办李同志,和平家住这儿吗,0
3257,82,2,傅明,对,0
3258,82,3,计生办李同志,啊啊好,0
3259,82,4,傅明,您是,0
3260,82,5,计生办李同志,我姓李我是和平他们单位计划生育办公室的,0
3261,82,6,傅明,哦 你好你好,0
3262,82,7,计生办李同志,您老人家是,0
3263,82,8,傅明,我是和平的公公请坐请坐,0
3264,82,9,傅明,我正要到你们单位去,0
3265,82,10,计生办李同志,哦 您不用去了和平啊已经领了圆圆去过了,0
3266,82,11,傅明,已经去过了她去干什么还带着圆圆,0
3267,82,12,计生办李同志,我就是想来进一步了解一下贾圆圆的情况,0
3268,82,13,傅明,了解圆圆的对对对对这个计划生育是应该先从娃娃抓起这个是不是太早了一点,1
3269,82,14,傅明,我们就是给圆圆宣传晚婚晚育的问题那也是将来的事嘛,1
3270,82,15,计生办李同志,哎呀 贾圆圆这个情况恐怕将来也不能够结婚更不要谈到生育了,1
3271,82,16,傅明,她妈的错误她也不能生育啦,1
3272,82,17,计生办李同志,老人家您说话不应该带脏字儿啊,1
3273,82,18,计生办李同志,我就是想来了解一下贾圆圆她生活上能不能够自理,1
3274,82,19,计生办李同志,自己能不能够穿衣服呢知道一加一等于几吗,1
3275,82,20,傅明,等于二 这个,1
3276,82,21,计生办李同志,她能不能够认识您是她的爷爷,1
3277,82,22,傅明,爷爷 这笑话嘛这个,1
3278,82,23,计生办李同志,另外呢 我还想了解一下除了外部原因以外她这个智力是不是在遗传基因上有什么缺陷,0
3279,82,24,傅明,嗯,0
3280,82,25,计生办李同志,当然啦和平的脑子是没有什么问题啦她会不会是隔代遗传,1
3281,82,26,傅明,隔代遗传隔代的遗传,1
3282,82,27,傅明,我这 这不岂有此理嘛这个,1
3283,82,28,计生办李同志,老人家 我明白了圆圆的情况您还不知道吧,0
3284,82,29,傅明,怎么啦,0
3285,82,30,计生办李同志,您 您情绪一定要镇静您坐好了我跟您说贾圆圆出车祸了,0
3286,82,31,傅明,什么伤的怎么样有没有生命危险,0
3287,82,32,计生办李同志,没有生命危险来来来来 您坐生命危险倒是没有不过也够戗了,0
3288,82,33,计生办李同志,您看看这个医生证明吧,0
3289,82,34,傅明,啊 怎么会出这样的事情呢,0
3290,82,35,圆圆,爷爷 快给我书包我都迟到两节,0
3291,82,36,计生办李同志,贾圆圆行了行了 贾圆圆你不要再装了,1
3292,82,37,傅明,圆圆圆圆你没有事吧,0
3293,82,38,计生办李同志,哎呀 老人家您也不要再装了哼 有的人为了逃避计划生育耍这种鬼把戏我们见的多了,0
3294,82,39,傅明,我装什么了我根本什么都不知道嘛,0
3295,82,40,计生办李同志,您知道也好不知道也好以后您多注意着点吧,0
3296,82,41,傅明,你先不要走你听我给你解释清楚,0
3297,82,42,计生办李同志,解释什么呀,0
3298,82,43,傅明,说起来我们还是同行嘛,0
3299,82,44,计生办李同志,同行哪那您就更不应该了,0
3300,82,45,傅明,你一定要听我把话真是天大的冤枉嘛,1
3301,82,46,傅明,你你你你搞的什么名堂嘛,0
3302,82,47,和平,什么呀爸哎爸 爸您怎么了啊,0
3303,83,0,傅明,和平啊，今天不去上班了吧？,0
3304,83,1,和平,啊今儿不去了，不开会,0
3305,83,2,傅明,好好好好，关于那个神秘电话的案件我已经完全侦破了,0
3306,83,3,傅明,今天，就叫你见个分晓,0
3307,83,4,和平,真的呀，爸您能先跟透露透露嘛？,0
3308,83,5,傅明,这个人你肯定认识，楼下小卖部新来了一个河南的小伙子，见过吧？,0
3309,83,6,和平,怎么又改他了？不是说是郑伯伯志国志新嘛,1
3310,83,7,傅明,噢，他们的嫌疑都已经排除啦现在嫌疑最大的就是这个河南小伙子,0
3311,83,8,傅明,他们都是同乡，小桂又经常上他那儿去买东西,0
3312,83,9,傅明,特别是，他那有一部公用电话这就是作案工具呀,0
3313,83,10,和平,听着倒是那么回事儿,0
3314,83,11,傅明,今天一大早，小桂起来就一个劲儿的打扮估计呀，是有什么约会,0
3315,83,12,傅明,我准备给她来一个化装跟踪,1
3316,83,13,傅明,搞她一个水落石出啊,0
3317,83,14,和平,爸，就您这岁数还化装跟踪,1
3318,83,15,和平,您行么您？,0
3319,83,16,傅明,怎么不行？,0
3320,83,17,傅明,当年地下党跟踪与反跟踪都练过，专业水平啊,1
3321,83,18,和平,还专业水平,0
3322,83,19,保姆小桂,爷爷，大姐，今天俺请一会儿假行么？就一会儿，不耽误中午做饭,0
3323,83,20,傅明,啊去吧去吧去吧，要是晚了，不回来也可以,1
3324,83,21,保姆小桂,嗳谢谢爷爷，谢谢大姐,0
3325,83,22,和平,诶，别客气,0
3326,83,23,傅明,看见没有，没跑儿，我现在就得去化装,0
3327,84,0,和平,今儿怎么这么早就回来了,0
3328,84,1,志国,有点儿报表 回家来赶,0
3329,84,2,志国,圆圆呢,0
3330,84,3,和平,哼 挨里屋画画呢,0
3331,84,4,和平,说了什么都不想了就准备当大画家了,0
3332,84,5,傅明,这就对了,0
3333,84,6,傅明,毛主席是怎么说的,0
3334,84,7,傅明,要让学生生动活泼主动地得到发展,1
3335,84,8,傅明,过去你们不听毛主席的话,0
3336,84,9,傅明,也不听我的话,1
3337,84,10,傅明,非得让圆圆当什么经济女强人,0
3338,84,11,傅明,实践证明是错误的嘛走了弯路了嘛,0
3339,84,12,和平,您觉着她现在走的这是正路,0
3340,84,13,傅明,那当然喽,0
3341,84,14,傅明,我们现在是从她的兴趣出发,0
3342,84,15,傅明,她爱画画我们就让她学画画,0
3343,84,16,傅明,我看这样发展下去还是大有前途的哩,1
3344,84,17,和平,发展是发展,0
3345,84,18,和平,可她这逮谁画谁这劲儿我可受不了,1
3346,84,19,和平,今儿嘿,0
3347,84,20,和平,我刚这伸懒腰伸一半儿,0
3348,84,21,和平,她告诉说 别动,1
3349,84,22,和平,二十多分钟弄得我这现在我这腰还酸着呢,1
